136/2020;NUAL;25/06/2020;00060-00271512/2020-97;Clayton;446/2020;7;203296;2;X;X;PINÇA CRILLER RETA, Aplicação: Hemostasia, Material: Aço inoxidável AISI, Tamanho: 140 mm,  Características Adicionais: A pinça deverá ter as pontas delicadas e as serrilhas precisas para fazer adequadamente as hemostasias. A cremalheira deverá ter um funcionamento suave e progressivo, sem trancos e sem escapar com facilidade. O encaixe não deverá ser muito justo, a ponto de dificultar a abertura e o fechamento da peça, mas também não poderá ser muito folgado, a ponto de dificultar a apreensão dos tecidos. Os encaixes não deverão ter buracos ou frestas que possam acumular detritos provocando manchas e/ou corrosão. As pinças não poderão ter cantos vivos, que possam ferir os pacientes ou cortar as luvas dos cirurgiões. O funcionamento geral da peça deverá ser suave, sem raspar no encaixe, sem machucar os dedos e o polimento deverá ser o mais perfeito possível. O tratamento térmico deverá ser integral a fim de conferir às peças a dureza e flexibilidades necessárias ao seu desempenho. As pinças deverão ser as mais leves possíveis. Cada peça deverá ter uma gravação eletroquímica com clara identificação do fabricante e código/lote de identificação da data de fabricação, iniciais da instituição (SES-DF). Embalagem individual, Processo de Esterilização: Não estéril , Forma de Apresentação: Unidade, Prazo de Validade: Indeterminado.;UN;50;*CANCELADO;;; R$-   ;15/12/2020;;;;;;;6;FALTA DE RECURSO;;;;;0
136/2020;NUAL;25/06/2020;00060-00271512/2020-97;Clayton;446/2020;1;203216;2;X;X;"PINÇA ÓSSEA LANE SEM CREMALHEIRA, Aplicação: Cirurgia Ortopédica Material: Aço inoxidável AISI, Tamanho:220 mm , Características: As pontas deverão apresentar um bom acabamento superficial.  Por ser composta por mais de um componente não deverá apresentar buracos, frestas ou folga quando montada; ter um funcionamento suave e progressivo, sem trancos e sem escapar com facilidade.  O peso deverá ser o menor possível e o polimento isento de buracos ou defeitos superficiais que possam provocar manchas ou corrosão.  Cada peça deverá ter uma gravação eletroquímica com clara identificação do fabricante e código/lote de identificação da data de fabricação, iniciais da instituição (SES-DF).  Embalagem individual.Processo de Esterilização:Não estéril,Forma de apresentação:Unidade, Prazo de validade:Indeterminado.";UN;5;*CANCELADO;;; R$-   ;15/12/2020;;;;;;;6;FALTA DE RECURSO;;;;;0
136/2020;NUAL;25/06/2020;00060-00271512/2020-97;Clayton;446/2020;4;203219;2;X;X;"PINÇA ÓSSEA LOWMANN 1 X 2 DENTES, Aplicação: Cirurgia Ortopédica Material: Aço inoxidável AISI, Tamanho:185 mm Características: As pontas deverão apresentar um bom acabamento superficial. Por ser composta por mais de um componente não deverá apresentar buracos, frestas ou folga quando montada; ter um funcionamento suave e progressivo, sem trancos e sem escapar com facilidade. O peso deverá ser o menor possível e o polimento isento de buracos ou defeitos superficiais que possam provocar manchas ou corrosão. Cada peça deverá ter uma gravação eletroquímica com clara identificação do fabricante e código/lote de identificação da data de fabricação, iniciais da instituição (SES-DF). Embalagem individual.Processo de Esterilização: Não estéril Forma de apresentação:Unidade Prazo de validade:.Indeterminado.";UN;8;*CANCELADO;;; R$-   ;15/12/2020;;;;;;;6;FALTA DE RECURSO;;;;;PINÇA ÓSSEA LOWMANN 1 X 2 DENTES
136/2020;NUAL;25/06/2020;00060-00271512/2020-97;Clayton;446/2020;2;203217;2;X;X;"PINÇA ÓSSEA LOWMANN 1 X 2 DENTES,Aplicação: Cirurgia Ortopédica Material: Aço inoxidável AISI,Tamanho:120 mm Características: As pontas deverão apresentar um bom acabamento superficial.  Por ser composta por mais de um componente não deverá apresentar buracos, frestas ou folga quando montada; ter um funcionamento suave e progressivo, sem trancos e sem escapar com facilidade.  O peso deverá ser o menor possível e o polimento isento de buracos ou defeitos superficiais que possam provocar manchas ou corrosão.  Cada peça deverá ter uma gravação eletroquímica com clara identificação do fabricante e código/lote de identificação da data de fabricação, iniciais da instituição (SES-DF). Embalagem individual.Processo de Esterilização:Não estéril,Forma de apresentação:Unidade Prazo de validade:Indeterminado.";UN;8;*CANCELADO;;; R$-   ;15/12/2020;;;;;;;6;FALTA DE RECURSO;;;;;0
136/2020;NUAL;25/06/2020;00060-00271512/2020-97;Clayton;446/2020;3;203218;2;X;X;"PINÇA ÓSSEA LOWMANN 1 X 2 DENTES,Aplicação: Cirurgia Ortopédica Material: Aço inoxidável AISI,Tamanho:200 mm, Características: As pontas deverão apresentar um bom acabamento superficial. Por ser composta por mais de um componente não deverá apresentar buracos, frestas ou folga quando montada; ter um funcionamento suave e progressivo, sem trancos e sem escapar com facilidade. O peso deverá ser o menor possível e o polimento isento de buracos ou defeitos superficiais que possam provocar manchas ou corrosão. Cada peça deverá ter uma gravação eletroquímica com clara identificação do fabricante e código/lote de identificação da data de fabricação, iniciais da instituição (SES-DF). Embalagem individual.Processo de Esterilização: Não estéril Forma de apresentação:Unidade Prazo de validade: Indeterminado.";UN;8;*CANCELADO;;; R$-   ;15/12/2020;;;;;;;6;FALTA DE RECURSO;;;;;PINÇA ÓSSEA LOWMANN 1 X 2 DENTES
136/2020;NUAL;25/06/2020;00060-00271512/2020-97;Clayton;446/2020;5;203221;2;X;X;"PINÇA PARA REDUÇÃO ÓSSEA COM PONTA FINA E CREMALHEIRA, Aplicação: Cirurgia Ortopédica Material: Aço inoxidável AISI, Tamanho:200 mm  Características: Pinça para redução óssea com pontas, dispositivo de compressão com cremalheira para redução direta ou redução percutanea. As pontas deverão apresentar um bom acabamento superficial.  Por ser composta por mais de um componente não deverá apresentar buracos, frestas ou folga quando montada; ter um funcionamento suave e progressivo, sem trancos e sem escapar com facilidade.  O peso deverá ser o menor possível e o polimento isento de buracos ou defeitos superficiais que possam provocar manchas ou corrosão.  Cada peça deverá ter uma gravação eletroquímica com clara identificação do fabricante e código/lote de identificação da data de fabricação, iniciais da instituição (SES-DF). Embalagem individual.Processo de Esterilização: Não estéril Forma de apresentação:Unidade, Prazo de validade: Indeterminado.";UN;5;*CANCELADO;;; R$-   ;15/12/2020;;;;;;;6;FALTA DE RECURSO;;;;;0
136/2020;NUAL;25/06/2020;00060-00271512/2020-97;Clayton;446/2020;6;203222;2;X;X;"PINÇA PARA REDUÇÃO ÓSSEA COM PONTAS,Aplicação: Cirurgia Ortopédica Material: Aço inoxidável AISI,  Tamanho: 160 mm  Características: Pinça para redução óssea com pontas, dispositivo de compressão com cremalheira para redução direta ou redução percutanea. As pontas deverão apresentar um bom acabamento superficial.  Por ser composta por mais de um componente não deverá apresentar buracos, frestas ou folga quando montada; ter um funcionamento suave e progressivo, sem trancos e sem escapar com facilidade.  O peso deverá ser o menor possível e o polimento isento de buracos ou defeitos superficiais que possam provocar manchas ou corrosão.  Cada peça deverá ter uma gravação eletroquímica com clara identificação do fabricante e código/lote de identificação da data de fabricação, iniciais da instituição (SES-DF).  Embalagem individual.Processo de Esterilização: Não estéril , Forma de apresentação:Unidade Prazo de validade: Indeterminado";UN;5;*CANCELADO;;; R$-   ;15/12/2020;;;;;;;6;FALTA DE RECURSO;;;;;0
137/2020;NUAL;25/06/2020;00060-00269888/2020-31;Clayton;447/2020;1;31528;2;X;X;"PORTA AGULHA MAYO HEGAR SEM VÍDEA, Aplicação: Fixação da agulha em sutura de tecidos, Material: Aço inoxidável AISI, Tamanho: 200 mm, Características: As pontas deverão ser bem delicadas, com bom acabamento. A peça não deverá apresentar buracos, frestas ou folga no encaixe. A cremalheira deverá ter um funcionamento suave e progressivo, sem trancos e sem escapar com facilidade. O funcionamento geral da peça deverá ser suave, sem raspar no encaixe, sem machucar os dedos e o polimento deverá ser o mais perfeito possível, naturalmente compatível com a aplicação a qual se destina o instrumento. Quando se tratar de porta-agulha com pastilha de tungstênio:- a junção entre a pastilha e o porta-agulha não deverá apresentar poros, nem falhas;- a pastilha de tungstênio não poderá descolar do porta-agulha com facilidade; - apresentar os anéis dourados para identificar que se tratam de porta-agulha com pastilha de tungstênio.  Cada peça deverá ter uma gravação a laser com clara identificação do fabricante e código / lote de identificação da data de fabricação, iniciais da instituição (SES-DF). Embalagem individual, Processo de esterilização: Não estéril, Forma de apresentação: Unidade, Prazo de validade: Indeterminado.";UN;50;*CANCELADO;;; R$-   ;15/12/2020;;;;;;;6;FALTA DE RECURSO;;;;;0
137/2020;NUAL;25/06/2020;00060-00269888/2020-31;Clayton;447/2020;3;203104;2;X;X;PORTA AGULHA MAYO HEGAR, Aplicação: Sutura.Material:aço inoxidável AISI,Tamanho: 140 mm mmCaracterísticas adicionais: As pontas deverão ser bem delicadas, com bom acabamento. A peça não deverá apresentar buracos, frestas ou folga no encaixe. A cremalheira deverá ter um funcionamento suave e progressivo, sem trancos e sem escapar com facilidade. O funcionamento geral da peça deverá ser suave, sem raspar no encaixe, sem machucar os dedos e o polimento deverá ser o mais perfeito possível, naturalmente compatível com a aplicação a qual se destina o instrumento. Apresentar uma serrilha que realize uma pega adequada da agulha. Cada peça deverá ter uma gravação eletroquímica com clara identificação do fabricante e código/lote de identificação da data de fabricação, iniciais da instituição (SES-DF). Embalagem individual.Processo de esterilização: Não estéril, Forma de apresentação: Unidade.Prazo de validade: Indeterminado.;UN;30;*CANCELADO;;; R$-   ;15/12/2020;;;;;;;6;FALTA DE RECURSO;;;;;0
137/2020;NUAL;25/06/2020;00060-00269888/2020-31;Clayton;447/2020;2;31532;2;X;X;"PORTA AGULHA RYDER, Aplicação: Sutura microvascular, Material: Aço inoxidável AISI, Tamanho: 180 mm,  Características Adicionais  : As pontas deverão ser bem delicadas, com bom acabamento. A peça não deverá apresentar buracos, frestas ou folga no encaixe. A cremalheira deverá ter um funcionamento suave e progressivo, sem trancos e sem escapar com facilidade. O funcionamento geral da peça deverá ser suave, sem raspar no encaixe, sem machucar os dedos e o polimento deverá ser o mais perfeito possível, naturalmente compatível com a aplicação a qual se destina o instrumento. Por se tratar de porta-agulha com pastilha de tungstênio:- a junção entre a pastilha e o porta-agulha não deverá apresentar poros, nem falhas;- a pastilha de tungstênio não poderá descolar do porta-agulha com facilidade; - apresentar os anéis dourados para identificar que se tratam de porta-agulha com pastilha de tungstênio.  Cada peça deverá ter uma gravação eletroquímica com clara identificação do fabricante e código / lote de identificação da data de fabricação, iniciais da instituição (SES-DF). Embalagem individual, Processo de Esterilização: Não estéril , Forma de apresentação: Unidade., Prazo de Validade: Indeterminado.";UN;20;*CANCELADO;;; R$-   ;15/12/2020;;;;;;;6;FALTA DE RECURSO;;;;;0
138/2020;NUAL;25/06/2020;00060-00270023/2020-18;Clayton;448/2020;2;15154;1;X;X;CUBA REDONDA, Aplicação: Utilizada para colocação de líquidos utilizados em cirurgia (soro fisiológico ou soluções), Material: Aço Inoxidável Cirúrgico AISI, Tamanho: 250 ml,  Característica: O material deverá ter um tratamento térmico integral, a fim de atingir a dureza e a flexibilidade adequada a um perfeito desempenho. O peso deverá ser o menor possível e o polimento isento de buracos ou defeitos superficiais que possam provocar manchas ou corrosão. Cada peça deverá ter uma gravação eletroquímica com clara identificação do fabricante e código/ lote de identificação da data de fabricação, inciais da instituição( SES-DF), Processo de Esterilização: Não Estéril, Forma de Apresentação: Unidade,  Prazo de Validade: Indeterminado .;UN;80;*CANCELADO;;; R$-   ;15/12/2020;;;;;;;6;FALTA DE RECURSO;;;;;0
138/2020;NUAL;25/06/2020;00060-00270023/2020-18;Clayton;448/2020;4;203010;2;X;X;CUBA REDONDA, Aplicação:Recipiente para soluções.Material: Aço inoxidável AISI,Tamanho: 150 ml, Características adicionais: A peça deverá apresentar um bom acabamento superficial e ser adequada ao trabalho a que se destina. O material deverá ter tratamento térmico integral a fim de atingir a dureza adequada a um perfeito desempenho. O polimento deverá ser isento de buracos ou defeitos superficiais que possam provocar manchas ou corrosão. Cada peça deverá ter uma gravação a laser com clara identificação do fabricante e código / lote de identificação da data de fabricação, iniciais da instituição (SES-DF). Embalagem individual.Não estéril, Forma de apresentação:  Unidade, Prazo de validade: Indeterminado.;UN;20;*CANCELADO;;; R$-   ;15/12/2020;;;;;;;6;FALTA DE RECURSO;;;;;0
138/2020;NUAL;25/06/2020;00060-00270023/2020-18;Clayton;448/2020;1;14522;1;X;X;CUBA RETANGULAR EM AÇO INOX MED.20X30X1,5CM (USO ODONTÓLOGICO).;UN;50;*CANCELADO;;; R$-   ;15/12/2020;;;;;;;6;FALTA DE RECURSO;;;;;0
138/2020;NUAL;25/06/2020;00060-00270023/2020-18;Clayton;448/2020;3;202937;1;X;X;CUBA RETANGULAR, Aplicação: Acondicionar instrumental para esterilização, Material: Aço inoxidável AISI, Tamanho: 320 x 230 x 40 mm,  Características: A peça deverá apresentar um bom acabamento superficial e ser adequada ao trabalho a que se destina. O material deverá ter tratamento térmico integral a fim de atingir a dureza adequada a um perfeito desempenho. O polimento deverá ser isento de buracos ou defeitos superficiais que possam provocar manchas ou corrosão. Cada peça deverá ter uma gravação a laser com clara identificação do fabricante e código / lote de identificação da data de fabricação, iniciais da instituição (SES-DF). Embalagem individual, Processo de esterilização: Não estéril, Forma de apresentação: Unidade, Prazo de validade: Indeterminado.;UN;30;*CANCELADO;;; R$-   ;15/12/2020;;;;;;;6;FALTA DE RECURSO;;;;;0
139/2020;NUAL;25/06/2020;00060-00270131/2020-91;Clayton;449/2020;1;13280;1;X;X;TESOURA  DE MAYO-STILLE RETA, Aplicação: Cirurgia Vascular, Material: Aço inoxidável Composição Química, Tamanho: 170 mm,  Características Adicionais: As tesouras deverão ter um tratamento térmico integral, a fim de atingir a dureza e a flexibilidade adequadas a um perfeito desempenho. Os parafusos das articulações deverão estar devidamente regulados a fim de que o funcionamento da tesoura seja suave e progressivo sem ferir ou mascar os tecidos e, ao mesmo tempo, não desgaste excessivamente em função do atrito de uma lâmina contra a outra. As pontas deverão ser delicadas e adequadas ao trabalho a que se destinam. O peso deverá ser o menor possível e o polimento isento de buracos ou defeitos superficiais que possam provocar manchas ou corrosão. Quando se tratar de tesouras com inserto de metal duro, deverão possuir os anéis dourados para fins de identificação. A peça deverá ter uma gravação com clara identificação do fabricante, iniciais da instituição (SES-DF) e código/lote de identificação da data de fabricação, Processo de Esterilização: Não estéril , Forma de apresentação: Unidade, Prazo de Validade: Indeterminado.;UN;50;*CANCELADO;;; R$-   ;15/12/2020;;;;;;;6;FALTA DE RECURSO;;;;;0
139/2020;NUAL;25/06/2020;00060-00270131/2020-91;Clayton;449/2020;2;29735;1;X;X;"TESOURA JOSEPH  CURVA, Aplicação: Microcirurgia para Secção de tecidos. Material: Aço inoxidável AISI ; Tamanho: 14 cm, Características adicionais: A tesoura deverá ter um tratamento térmico integral, a fim de atingir a dureza e a flexibilidade adequadas a um perfeito desempenho. Os parafusos das articulações deverão estar devidamente regulados a fim de que o funcionamento da tesoura seja suave e progressivo sem ferir ou mascar os tecidos e, ao mesmo tempo, não desgaste excessivamente em função do atrito de uma lâmina contra a outra. As pontas deverão ser delicadas e adequadas ao trabalho a que se destinam. O peso deverá ser o menor possível e o polimento isento de buracos ou defeitos superficiais que possam provocar manchas ou corrosão.  Deve ter registro no Ministério da Saúde. Cada peça deverá ter uma gravação eletroquímica com clara identificação do fabricante e código/lote de identificação da data de fabricação, iniciais da instituição (SES-DF). Embalagem individual. Processo de esterilização: Não estéril, Forma de apresentação: Unidade, Prazo de validade: Indeterminado.";UN;5;*CANCELADO;;; R$-   ;15/12/2020;;;;;;;6;FALTA DE RECURSO;;;;;0
144/2020;NUAL;26/06/2020;00060-00271931/2020-29;Robson;450/2020;1;51453;6;x;x;GORRO DESCARTÁVEL,Material: em falso tecido, viscose poliéster ou polipropileno, Gramatura: mínima de 30g/m²,   Cor: azul ou verde, Formato: anatômico que permita ajuste perfeito à cabeça, Dimensões: mínimas de : parte central 12cm de largura, 25cm de comprimento, aba de 13cm de largura e 80cm de comprimento.;UN;10.000;MEDLIVE (701879);10.000; R$ 0,2100 ; R$2.100,00 ;06/07/2020;549493;06/07/2020;10/07/2020;13/07/2020;46084;20/07/2020;4;;;;;;GORRO DESCARTÁVEL
278/2020;NFH;29/06/2020;00060-00275511/2020-11;Jefferson;451/2020;1;90458;7;X;X;ROCURÔNIO SOLUÇÃO INJETÁVEL 10 MG/ML FRASCO AMPOLA 5ML;FA;200;MEDCOM Filial (703839);200; R$ 10,4900 ; R$2.098,00 ;03/07/2020;6382;17/07/2020;20/07/2020;21/07/2020;54215;03/08/2020;4;;;;;;ROCURÔNIO SOLUÇÃO INJETÁVEL 10 MG/ML FRASCO AMPOLA 5ML
277/2020;NFH;29/06/2020;00060-00275483/2020-32;Jefferson;452/2020;1;90555;4;X;X;CLORETO DE SODIO SOLUÇAO INJETAVEL 20 % (3,4 MEQ/ML) AMPOLA 10 ML;AMP;1.000;FARMARIN (701211);1.000; R$ 0,2700 ; R$270,00 ;07/07/2020;250581;10/07/2020;27/07/2020;21/07/2020;53926;03/08/2020;4;;;;;;CLORETO DE SODIO SOLUÇAO INJETAVEL 20 % (3
279/2020;NFH;29/06/2020;00060-00276128/2020-81;Jefferson;453/2020;1;36552;3;X;X;CURATIVO ANTISSÉPTICO CIRCULAR PRONTO PARA USO, ESTÉRIL. Aplicação: curativo para finalização do procedimento de punção venosa ou injeções. Composição: poliéster com algodão natural e papel siliconado. Características adicionais: a embalagem do produto deverá conter o número do lote, data de fabricação, prazo de validade, composição, forma de armazenamento e procedência. Processo de esterilização: estéril. Unidade de estoque: unidade. Apresentação: caixa com 500 unidades.  ;UN;20.000;SUPERMÉDICA (702730);20.000; R$ 0,0300 ; R$600,00 ;03/07/2020;87300;06/07/2020;07/07/2020;13/07/2020;45780;20/07/2020;4;;;;;;CURATIVO ANTISSEPTICO
280/2020;NFH;29/06/2020;00060-00276251/2020-00;Bruno;454/2020;1;5310;2;X;X;"SWABS-LENÇO OU GAZE UMED. C/ALCOOL ISOPROPÍLICO 70% P/ ASSEPSIA DE PELE. Swab-lenço umedecido com álcool isopropílico 70%; medindo aproximadamente 3 cm x 6 cm (+/ 0,5 cm) aberto; Uso Descartável; Embalado individualmente em envelope sachê que garanta a integridade do produto. ";UN;30.000;APOLLO (703256);3.000; R$ 0,10000 ; R$300,00 ;27/07/2020;13731;30/07/2020;30/07/2020;31/07/2020;63310;18/08/2020;4;;;;;;0
281/2020;NFH;29/06/2020;00060-00276344/2020-26;Jefferson;455/2020;1;90580;7;X;X;AGUA PARA INJETAVEIS AMPOLA 10 ML;AMP;16.000;FARMARIN (701211);16.000; R$ 0,1800 ; R$2.880,00 ;07/07/2020;250580;10/07/2020;17/07/2020;21/07/2020;54255;03/08/2020;4;;;;;; AGUA PARA INJETAVEIS AMPOLA 10 ML
146/2020;NUAL;30/06/2020;00060-00279674/2020-73;Bruno;456/2020;1;63295;8;X;X;TOUCA HOSPITALAR DESCARTÁVEL,Material: tecido não tecido, Tipo Uso: descartável, Gramatura: 20 g/m², Características Adicionais:  com elástico em toda volta (tipo elastex);UN;40.000;NL SUPERMEDICAL (700820);40.000; R$ 0,1200 ; R$4.800,00 ;08/07/2020;25337;09/07/2020;10/07/2020;13/07/2020;46952;21/07/2020;4;;;;;;TOUCA HOSPITALAR
148/2020;NUAL;30/06/2020;00060-00281516/2020-83;Oberdan;457/2020;1;201158;7;X;X;SAPATILHA DESCARTÁVEL. Material: polipropileno antiderrapante, Características Adicionais: gramatura mínima de 40g/m², resistente, com acabamento elástico que permita bom ajuste e cobertura completa do calçado até o tornozelo. Tamanho com aproximadamente 35 cm de comprimento por 20 cm de altura. Embalagem com 50 pares (100 unidades). Unidade de estoque: par (PAR). Unidade de fornecimento: par.;PR;20.000;CONECTTA (703936);10.000; R$ 0,2800 ; R$2.800,00 ;03/07/2020;6;03/08/2020;03/08/2020;03/08/2020;91189;30/09/2020;5;valor corrigido quantidade tava errado;;;;;SAPATILHA DESCARTÁVEL
283/2020;NFH;30/06/2020;00060-00281154/2020-21;Jefferson;458/2020;1;91118;2;X;X;EQUIPO DE SAÍDA - LINHA VENOSA, ESTÉRIL, Aplicação: hemodiálise. Material: PVC atóxico. Características Adicionais: Transparente, flexível, com filtro, espessura 6mm, com conexões para medicação, com corta fluxo resistente. Embalagem individual em papel grau cirúrgico, que permita a abertura em técnica asséptica, capaz de assegurar a esterilidade do produto durante o transporte, armazenamento, até o momento do uso.;UN;250;FARMARIN (701211);240; R$ 5,8000 ; R$1.392,00 ;07/07/2020;250583;10/07/2020;17/07/2020;21/07/2020;54189;03/08/2020;4;;;;;;EQUIPO DE SAÍDA - LINHA VENOSA
147/2020;NUAL;30/06/2020;00060-00281441/2020-31;Bruno;459/2020;1;34084;3;X;X;"VERIFICAR CÓDIGO 10823 (MESMA DESCRIÇÃO COM ALTERAÇÃO DE ORDEM DE ELEMENTOS)AVENTAL DE PROCEDIMENTO NÃO ESTÉRIL,  Aplicação: biosegurança, EPI - barreira protetora aos profissionais de saúde nos procedimentos com exposição de fluídos e/ou contaminação por contato; Características Adicionais: com comprimento abaixo do joelho (com no mínimo 1,20 m), manga longa e punho sonfonado em algodão, confeccionado em polietileno trilaminado SMS com camadas de proteção resistente a penetração de fluídos (hidrorrepelente), não inflamável, faixa presa na cintura para fechamento nas costas, decote redondo próximo ao pescoço com tiras para amarrar, conferindo total proteção a roupa individual, que não cause nenhuma irritação ao usuário, fácil uso e que não proporcione liberação de partículas; Tamanho: ÚNICO; Forma de Apresentação: Unidade. Apresentar CA - Registro no Ministério do Trabalho- PORTARIA Nº 452, DE 20 DE NOVEMBRO DE 2014 e ANVISA. ";UN;10.000;WINNER (3979);4.320; R$ 7,5000 ; R$32.400,00 ;08/07/2020;23056;20/07/2020;20/07/2020;20/07/2020;54678;03/08/2020;4;CODIGO DUPLICADO??;;;;;AVENTAL DE PROCEDIMENTO NÃO ESTÉRIL
286/2020;NFH;30/06/2020;00060-00281363/2020-74;Jefferson;460/2020;1;31158;1;X;X;Equipo para uso exclusivo em bombas de infusão da marca SAMTRONIC ST1000 SET, com comprimento mínimo de 240cm, câmara gotejadora flexível com filtro de retenção de partículas de 15 microns, entrada de ar lateral com filtro bacteriológico de 0,2 microns e tampa. Segmento em silicone, injetor lateral em Y com membrana autocicatrizante, pinça rolete, conector luer lock com tampa oclusora com filtro. Fabricado com material atóxico, embalagem individual em papel grau cirúrgico. Estéril, invólucro resistente ao manuseio, lacre capaz de manter sua integridade e esterilidade. Apresentação: embalagem individual. ;UN;250;MICROMEDICAL (384);250; R$ 25,5000 ; R$6.375,00 ;07/07/2020;13078;08/07/2020;08/07/2020;14/07/2020;3296;03/08/2020;4;;;;;;EQUIPO PARA BOMBA DE INFUSÃO
285/2020;NFH;30/06/2020;00060-00281294/2020-07;Bruno;461/2020;2;35774;2;X;X;"AVENTAL/CAPOTE CIRÚRGICO ESTÉRIL, DESCARTÁVEL, TAMANHO ´M´. Avental cirúrgico estéril, descartável, tamanho médio (comprimento mínimo 110cm e largura mínima 140cm), fabricado em SMS, composto de não tecido 100% polipropileno, permitindo ventilação adequada durante o uso, garantindo maciez e resistência; hidro-repelente, resistente à penetração de líquidos, manga longa com punhos elásticos confeccionados em malha que mantenham as mangas estabilizadas, gramatura igual ou maior que 50g/m2, ajuste no pescoço para fechamento seguro. Junção ultrassônica/térmica em áreas críticas (mangas e junção das tiras de amarração). Tiras interna e externa com fechamento cruzados nas costas, cartão para transferência asséptica. Dobrado em forma de livro para abertura e colocação de forma asséptica, acompanhado de toalha para secagem das mãos de alta absorção. Embalado individualmente em dupla embalagem - interna de SMS e externa de papel grau cirúrgico. O produto deverá obedecer ás normas brasileiras vigentes (da NBR 16064 da ABNT).  ";UN;400;NR GOIÁS (702924);250; R$ 24,5000 ; R$6.125,00 ;15/07/2020;20222;02/09/2020;08/09/2020;11/09/2020;91677;30/09/2020;5;;;;;;AVENTAL CAPOTE CIRURGICO
