504/2020;NFH;09/11/2020;00060-00476471/2020-23;Jefferson;733/2020;2;92448;3;X;X;SONDA DE FOLEY 2 VIAS LÁTEX Nº 20. Aplicação: para drenagem e controle da diurese e irrigação vesical. Material: Látex atóxico.  Características Adicionais: estéril, descartável, siliconizada, medindo no mínimo 40 cm, apresentando flexibilidade e maleabilidade adequado ao fim a que se destina, que não cause irritação ao paciente, apresentando espessura uniforme, isenta de manchas ou quaisquer defeitos, balão com capacidade de 05 a 15 ml e boa distensibilidade, com válvula fixa que permita perfeita adaptação em seringas. Ponta arredondada e fechada, apresentando 02 orifícios ovais situados em lados opostos, delimitados e proporcionais ao diâmetro, isentos de rebarbas e/ou saliências que possam traumatizar o paciente. Embalagem dupla, sendo a externa em papel grau cirúrgico e a interna em polietileno picotada nas extremidades, favorecendo a abertura em técnica asséptica e garantindo a integridade e esterilidade do produto. Apresentação: embalagem individual, acondicionada em caixa com 10 unidades. Unidade de Estoque: unidade (UN). Código SES: 092448. BR0279769;UN;100;DMI (2073);100; R$ 3,9000 ; R$390,00 ;19/11/2020;;;;;;;6;Tinha sido suspenso em 09/11/2020 por falta de recurso financeiro;;;;;SONDA DE FOLEY 2 VIAS LÁTEX Nº 20
511/2020;NFH;12/11/2020;00060-00493454/2020-51;Clayton;734/2020;1;92408;4;X;X;"LUVA DE PROCEDIMENTO NÃO ESTÉRIL DE LÁTEX TAMANHO ""M"". Aplicação: uso em técnica não estéril como proteção do profissional. Material: látex íntegro. Tamanho: médio. Características Adicionais: ambidestra, lubrificada com pó bioabsorvível atóxico, que não cause danos ao organismo em condições normais de uso, devem apresentar boa resistência ao calçar, com látex íntegro,sem manchas, sem ponto de acúmulo látex e tamanho de acordo com a especificação, deve estar devidamente embalada de forma a permitir o empilhamento, transporte e armazenamento, a embalagem deve contero tamanho,o lote, a data de fabricação e de validade, conter número do C.A. Apresentação: embalagem contendo 100 (cem) unidades acondicionadas em caixa. Unidade De Estoque: unidade (UN), ";UN;35.500;MAFRA (703141);30.000; R$ 0,5500 ; R$16.500,00 ;13/11/2020;399026;13/11/2020;13/11/2020;17/11/2020;31860;03/12/2020;6;;;;;;"LUVA DE PROCEDIMENTO NÃO ESTÉRIL DE LÁTEX TAMANHO ""M"""
490/2020;NFH;19/10/2020;00060-00446936/2020-11;Oberdan;735/2020;1;5310;2;X;X;"SWABS-LENÇO OU GAZE UMED. C/ALCOOL ISOPROPÍLICO 70% P/ ASSEPSIA DE PELE. Swab-lenço umedecido com álcool isopropílico 70%; medindo aproximadamente 3 cm x 6 cm (+/ 0,5 cm) aberto; Uso Descartável; Embalado individualmente em envelope sachê que garanta a integridade do produto. ";UN;3.000;APOLLO (703256);3.000; R$ 0,0700 ; R$210,00 ;16/11/2020;16462;16/11/2020;17/11/2020;17/11/2020;31870;02/12/2020;6;Tinha sido suspenso em 16/10/2020 por falta de recurso financeiro;;;;;0
052/2020;NECFM;20/10/2020;00060-00450535/2020-66;Oberdan;736/2020;1;23150;1;X;X;"CONJUNTO MANIFOLD PARA GÁS FREON ART. R-12/ 22/ 502 - 134ª: Aplicação: medir a quantidade de pressão de gás utilizado na refrigeração e em ar condicionado; Característica: corpo em bronze com gancho rotatório, escala dupla de pressões PSIG/ Kg/ Cm ², escala dupla de temperaturas em ºC/ ºF, indicador de umidade e visor inclusos no corpo, disponível em modelos para R134A, mangueira 60ö  125cm, manômetros anti-vibração com escalas coloridas para fácil leitura, protetor plástico para evitar danos prematuros, incluso jogo de mangueiras para cada modelo; Peso entre 1,300 Kg e 1,900 Kg dependendo da marca. Prazo de Validade: não há, Unidade de Estoque: unidade.";UN;1;PRIMEIRA LINHA (878);1; R$ 332,5000 ; R$332,50 ;26/11/2020;523254;02/12/2020;10/12/2020;10/12/2020;.PASS 22/12;;6;Tinha sido suspenso em 16/10/2020 por falta de recurso financeiro;;;;;CONJUNTO MANIFOLD PARA GÁS FREON ART. R-12/ 22/ 502 - 134ª:
052/2020;NECFM;20/10/2020;00060-00450535/2020-66;Oberdan;736/2020;2;28772;2;X;X;Gás refrigerante, tipo r-134, aplicação sistema de geladeira, apresentação cilindro;KG;1;PRIMEIRA LINHA (878);1; R$ 70,0000 ; R$70,00 ;26/11/2020;523254;02/12/2020;10/12/2020;10/12/2020;.PASS 22/12;;6;Tinha sido suspenso em 16/10/2020 por falta de recurso financeiro;;;;;Gás refrigerante
491/2020;NFH;21/10/2020;00060-00453337/2020-54;Oberdan;737/2020;1;30972;7;X;X;CATETER NASAL ADULTO, EM SILICONE, TIPO ÓCULOS, PARA OXIGENOTERAPIA. Aplicação: oxigenoterapia em paciente adulto. Material: polivinil atóxico e silicone. Características Adicionais: com extensão mínima de 2,1 em PVC, flexível com ajuste e adaptação confortável, contendo um dispositivo que se adapte às narinas, todo em silicone flexível, com haste de sustentação sobre as orelhas (como óculos). Apresentação: embalagem individual, descartável, Unidade de Estoque: Unidade (UN). Não Estéril.;UN;500;MAFRA (703141);500; R$ 0,8500 ; R$425,00 ;16/11/2020;404011;25/11/2020;25/11/2020;08/12/2020;.PASS 22/12;;6;Tinha sido suspenso em 16/10/2020 por falta de recurso financeiro;;;;;CATETER NASAL ADULTO
492/2020;NFH;21/10/2020;00060-00453463/2020-17;Oberdan;738/2020;1;91207;4;X;X;CURATIVO DE HIDROFIBRA, ESTERIL. Composição: carboximetilcelulose associada à prata, estéril, não aderente. Tamanho: 15x15cm. Apresentação: embalagem individual.;UN;200;LM FARMA (692);200; R$ 49,5000 ; R$9.900,00 ;16/11/2020;57606;19/11/2020;26/11/2020;08/12/2020;.PASS 22/12;;6;Tinha sido suspenso em 16/10/2020 por falta de recurso financeiro;;;;;CURATIVO DE HIDROFIBRA
493/2020;NFH;21/10/2020;00060-00453568/2020-68;Oberdan;739/2020;1;27783;2;X;X;COMPRESSA ALGODONADA PARA CURATIVO TIPO COXIM 15CM x 30CM ESTERIL. Aplicação: como cobertura primária e/ou secundária em feridas altamente exsudativas e/ou saguinolentas e para proteção de proeminências ósseas. Material: tecido de gaze 100% algodão e algodão hidrófilo. Cáracteríscias Adicionais: em 13 fios, com acabamento que não libere fiapos nem resíduos de algodãos, medindo aberta 15 cm x 60 cm, com ausência de amido, alvejante óptico, fiapos e sujidades, altamente absorvente. Embalagem com selagem que assegure a esterilidade do produto em papel grau cirúrgico, ou similar, que permita abertura e transferência em técnica asséptica, sem delaminar. Apresentação: embalagem individual acondicionadas em caixas. Unidade de estoque: Unidade (UN).  BR0283949.;UN;1.200;*CANCELADO;;; R$-   ;;;;;;;;6;CENTRAL ABASTECIDA;;;;;COMPRESSA ALGODONADA PARA CURATIVO TIPO COXIM 15CM x 30CM ESTERIL
499/2020;NFH;29/10/2020;00060-00468589/2020-88;Oberdan;740/2020;1;92092;1;X;X;Cânula para traqueostomia, material polivinil flexível, formato ponta arredondada, tamanho 04, características adicionais balão de baixa pressão, tipo estéril e descartável. ;UN;400;*CANCELADO;; R$ 17,5300 ; R$-   ;16/11/2020;;;;;;;6;Email desistencia Tinha sido suspenso em 29/10/2020 por falta de recurso financeiro;;;;;Cânula para traqueostomia
054/2020;NECFM;26/10/2020;00060-00451833/2020-73;Oberdan;741/2020;1;35771;2;X;X;Sensor para Oximetria de Pulso (SPO²), tipo Y, para Oxímetro MINDRAY VS800 (neonatal).;UN;20;*CANCELADO;;; R$-   ;02/12/2020;;;;;;;6;Tinha sido suspenso em 27/10/2020 por falta de recurso financeiro;;;;;Sensor para Oximetria de Pulso (SPO²)
054/2020;NECFM;26/10/2020;00060-00451833/2020-73;Oberdan;741/2020;2;19084;1;X;X;SENSOR DE OXIMETRIA PARA EQUIPAMENTO OXP10 - EMAI. 1;UM;20;*CANCELADO;;; R$-   ;03/12/2020;;;;;;;6;Tinha sido suspenso em 27/10/2020 por falta de recurso financeiro;;;;;SENSOR DE OXIMETRIA PARA EQUIPAMENTO OXP10 - EMAI. 1
054/2020;NECFM;26/10/2020;00060-00451833/2020-73;Oberdan;741/2020;3;35511;1;X;X;Sensor neonatal tipo Y universal, confeccionado em silicone hospitalar de fácil limpeza e durabilidade, com cabo flexível de aproximadamente 3 m, com qualidade de leitura da saturação e frequência cardíaca do paciente. Os conectores devem seguir todas as normas e padrões internacionais, compatíveis com diversos modelos e marcas de oxímetros e monitores, podendo ser utilizados para uma checagem rápida ou monitoramento longo e continuo.';UN;20;*CANCELADO;;; R$-   ;04/12/2020;;;;;;;6;Tinha sido suspenso em 27/10/2020 por falta de recurso financeiro;;;;;Sensor neonatal tipo Y 
054/2020;NECFM;26/10/2020;00060-00451833/2020-73;Oberdan;741/2020;4;209;1;X;X;LÂMPADA UNIVERSAL, Aplicação: para uso em laringoscópio, Tensão: 2,5 Volts. Rosca Grossa, Características Adicionais: uso compatível com todas as marcas de laringoscópio.;UN;100;*CANCELADO;;; R$-   ;05/12/2020;;;;;;;6;Tinha sido suspenso em 27/10/2020 por falta de recurso financeiro;;;;;LÂMPADA UNIVERSAL
054/2020;NECFM;26/10/2020;00060-00451833/2020-73;Oberdan;741/2020;5;24543;3;X;X;LÂMPADA ALOGÊNEA, 12 volt's , 30 Wat's para uso em Microscópio em laboratório.;UN;30;*CANCELADO;;; R$-   ;06/12/2020;;;;;;;6;Tinha sido suspenso em 27/10/2020 por falta de recurso financeiro;;;;;LÂMPADA ALOGÊNEA
054/2020;NECFM;26/10/2020;00060-00451833/2020-73;Oberdan;741/2020;6;31885;1;X;X;LAMPÂDA PARA FOCO CIRURGICO, COMPATIVEL COM A MARCA MAQUET, MOD. BLUE - 80, REF. 64668 X IR 80W 22,8V.;UN;20;*CANCELADO;;; R$-   ;07/12/2020;;;;;;;6;Tinha sido suspenso em 27/10/2020 por falta de recurso financeiro;;;;;LAMPÂDA PARA FOCO CIRURGICO
501/2020;NFH;04/11/2020;00060-00476206/2020-45;Oberdan;742/2020;1;92033;3;X;X;TUBO ENDOTRAQUEAL, MATERIAL PVC SILICONIZADO ATÓXICO, TAMANHO 7.0, APLICAÇÃO ORAL, CARACTERÍSTICAS ADICIONAIS CURVA PRÉ-FORMADA, TIPO CONECTOR ADAPTÁVEL,SUPERFÍCIE LISA, TRANSMITÂNCIA LINHA RADIOPACA DE PONTA A PONTA, COMPONENTES BALÃO DE ALTO VOLUME E BAIXA PRESSÃO, TIPO USO DESCARTÁVEL, ESTERILIDADE ESTÉRIL, EMBALAGEM INDIVIDUAL.;UN;100;JJT AMARAL (703513);50; R$ 4,5200 ; R$226,00 ;10/12/2020;2148;11/12/2020;12/12/2020;17/12/2020;.PASS 22/12;;6;Tinha sido suspenso em 04/11/2020 por falta de recurso financeiro;;;;;TUBO ENDOTRAQUEAL
501/2020;NFH;04/11/2020;00060-00476206/2020-45;Oberdan;742/2020;2;92034;4;X;X;TUBO ENDOTRAQUEAL, MATERIAL PVC SILICONIZADO ATÓXICO, TAMANHO 7,5, APLICAÇÃO ORAL, CARACTERÍSTICAS ADICIONAIS CURVA PRÉ-FORMADA, TIPO CONECTOR ADAPTÁVEL,SUPERFÍCIE LISA, TRANSMITÂNCIA LINHA RADIOPACA DE PONTA A PONTA, COMPONENTES BALÃO DE ALTO VOLUME E BAIXA PRESSÃO, TIPO USO DESCARTÁVEL, ESTERILIDADE ESTÉRIL, EMBALAGEM INDIVIDUAL.;UN;100;JJT AMARAL (703513);50; R$ 4,5600 ; R$228,00 ;10/12/2020;2148;11/12/2020;12/12/2020;17/12/2020;.PASS 22/12;;6;Tinha sido suspenso em 04/11/2020 por falta de recurso financeiro;;;;;TUBO ENDOTRAQUEAL
501/2020;NFH;04/11/2020;00060-00476206/2020-45;Oberdan;742/2020;3;92035;6;X;X;TUBO ENDOTRAQUEAL, MATERIAL PVC SILICONIZADO ATÓXICO, TAMANHO 8.0, APLICAÇÃO ORAL, CARACTERÍSTICAS ADICIONAIS CURVA PRÉ-FORMADA, TIPO CONECTOR ADAPTÁVEL,SUPERFÍCIE LISA, TRANSMITÂNCIA LINHA RADIOPACA DE PONTA A PONTA, COMPONENTES BALÃO DE ALTO VOLUME E BAIXA PRESSÃO, TIPO USO DESCARTÁVEL, ESTERILIDADE ESTÉRIL, EMBALAGEM INDIVIDUAL.;UN;100;JJT AMARAL (703513);50; R$ 4,5300 ; R$226,50 ;10/12/2020;2148;11/12/2020;12/12/2020;17/12/2020;.PASS 22/12;;6;Tinha sido suspenso em 04/11/2020 por falta de recurso financeiro;;;;;TUBO ENDOTRAQUEAL
505/2020;NFH;09/11/2020;00060-00476628/2020-11;Oberdan;743/2020;1;12285;1;X;X;SISTEMA FECHADO DE ASPIRAÇÃO TRAQUEAL VIA CÂNULA DE TRAQUEOSTOMIA INFANTIL 12FR, ESTÉRIL. Tamanho/Capacidade: infantil-12 FR,adaptável a cânulas de traqueostomia de tamanhos 6.0 e 6.5, Aplicação: aspiração de secreção traqueal via cânula de traqueostomia, Material: sonda de silicone e bainha de plástico ou silicone, Características Adicionais: estéril,flexível,com sonda graduada em centímetros, que não solta a tinta ,maleável,com orifícios na extremidade de aspiração e ponta arredondada,com bainha plástica,transparente,siliconizada ou não envolvendo a sonda,conexão em ``Y`` ou em ``T`` para adaptação/encaixe ao tubo ou cânula de traqueostomia de um lado e circuito de ventilador mecânico do outro.Via de irrigação com válvula anti-refluxo para fluidificar secreções e realizar limpeza interna da sonda e válvula para controle de vácuo ergonômica e com trava por pressão.Com conector para administração de aerossol.Livre de látex, Apresentação: embalagem individual, Unidade De Estoque: unidade(UN), Código SES: 012285. ;UN;10;*CANCELADO;;; R$-   ;;;;;;;;6;Tinha sido suspenso em 09/11/2020 por falta de recurso financeiro;;;;;SISTEMA FECHADO DE ASPIRAÇÃO TRAQUEAL VIA CÂNULA DE TRAQUEOSTOMIA 12 FR INFANTIL
505/2020;NFH;09/11/2020;00060-00476628/2020-11;Oberdan;743/2020;2;12287;1;X;X;SISTEMA FECHADO DE ASPIRAÇÃO TRAQUEAL VIA CÂNULA DE TRAQUEOSTOMIA ADULTO 14FR, ESTÉRIL. Tamanho/Capacidade: adulto-14 FR,adaptável a cânulas de traqueostomia de tamanhos 7.0 e 7.5, Aplicação: aspiração de secreção traqueal via cânula de traqueostomia, Material: sonda de silicone e bainha de plástico ou silicone, Características Adicionais: estéril,flexível,com sonda graduada em centímetros, que não solta a tinta ,maleável,com orifícios na extremidade de aspiração e ponta arredondada,com bainha plástica,transparente,siliconizada ou não envolvendo a sonda,conexão em ``Y`` ou em ``T`` para adaptação/encaixe ao tubo ou cânula de traqueostomia de um lado e circuito de ventilador mecânico do outro.Via de irrigação com válvula anti-refluxo para fluidificar secreções e realizar limpeza interna da sonda e válvula para controle de vácuo ergonômica e com trava por pressão.Com conector para administração de aerossol.Livre de látex, Apresentação: embalagem individual, Unidade De Estoque: unidade(UN), Código SES: 012287. ;UN;10;JJT AMARAL (703513);10; R$ 97,1800 ; R$971,80 ;09/12/2020;;;;;;;6;Tinha sido suspenso em 09/11/2020 por falta de recurso financeiro;;;;;SISTEMA FECHADO DE ASPIRAÇÃO TRAQUEAL ADULTO 14 FR
505/2020;NFH;09/11/2020;00060-00476628/2020-11;Oberdan;743/2020;3;12289;6;X;X;SISTEMA FECHADO DE ASPIRAÇÃO TRAQUEAL VIA CÂNULA DE TRAQUEOSTOMIA ADULTO 16 FR, ESTÉRIL. Aplicação: aspiração de secreção traqueal via cânula de traqueostomia, Material: sonda de silicone e bainha de plástico ou silicone, Características Adicionais:  adaptável a cânulas de traqueostomia de tamanhos 8.0, 8.5 e 9.0, flexível,com sonda graduada em centímetros, que não solta a tinta ,maleável,com orifícios na extremidade de aspiração e ponta arredondada,com bainha plástica,transparente,siliconizada ou não, envolvendo a sonda,conexão em ``Y`` ou em ``T`` para adaptação/encaixe ao tubo ou cânula de traqueostomia de um lado e circuito de ventilador mecânico do outro.Via de irrigação com válvula anti-refluxo para fluidificar secreções e realizar limpeza interna da sonda e válvula para controle de vácuo ergonômica e com trava por pressão.Com conector para administração de aerossol.Livre de látex, Apresentação: embalagem individual, Unidade De Estoque: unidade(UN), Código SES: 012289. BR276325;UN;10;*CANCELADO;;; R$-   ;;;;;;;;6;Tinha sido suspenso em 09/11/2020 por falta de recurso financeiro;;;;;SISTEMA FECHADO DE ASPIRAÇÃO TRAQUEAL VIA CÂNULA DE TRAQUEOSTOMIA ADULTO 16 FR
505/2020;NFH;09/11/2020;00060-00476628/2020-11;Oberdan;743/2020;4;12290;8;X;X;SISTEMA FECHADO DE ASPIRAÇÃO TRAQUEAL VIA TUBO OROTRAQUEAL ADULTO 16 FR, ESTÉRIL. Aplicação: aspiração de secreção traqueal via tubo orotraqueal. Material: sonda de silicone e bainha de plástico ou silicone. Características Adicionais: adaptável a tubos de tamanho 8.0, 8.5 e 9.0, flexível,com sonda graduada em centímetros, que não solta a tinta ,maleável,com orifícios na extremidade de aspiração e ponta arredondada,com bainha plástica,transparente,siliconizada ou não,envolvendo a sonda,conexão em ``Y`` ou em ``T`` para adaptação/encaixe ao tubo ou cânula orotraqueal de um lado e circuito de ventilador mecânico do outro.Via de irrigação com válvula anti-refluxo para fluidificar secreções e realizar limpeza interna da sonda e válvula para controle de vácuo ergonômica e com trava por pressão.Com conector para administração de aerossol.Livre de látex, Apresentação: embalagem individual, Unidade De Estoque: unidade(UN), Código SES: 012290. BR276324;UN;10;JJT AMARAL (703513);10; R$ 97,1800 ; R$971,80 ;09/12/2020;;;;;;;6;Tinha sido suspenso em 09/11/2020 por falta de recurso financeiro;;;;;SISTEMA FECHADO DE ASPIRAÇÃO TRAQUEAL VIA TUBO OROTRAQUEAL ADULTO 16 FR
183/2020;NUAL;13/11/2020;00060-00494397/2020-27;Robson;744/2020;1;51453;6;X;X;GORRO DESCARTÁVEL,Material: em falso tecido, viscose poliéster ou polipropileno, Gramatura: mínima de 30g/m²,   Cor: azul ou verde, Formato: anatômico que permita ajuste perfeito à cabeça, Dimensões: mínimas de : parte central 12cm de largura, 25cm de comprimento, aba de 13cm de largura e 80cm de comprimento.;UN;10.000;DBLASSL (703930);2.000; R$ 0,6600 ; R$1.320,00 ;23/11/2020;69;23/11/2020;25/11/2020;25/11/2020;.PASS 22/12;;6;;;;;;GORRO DESCARTÁVEL
185/2020;NUAL;13/11/2020;00060-00494414/2020-26;Robson;745/2020;1;63295;8;X;X;TOUCA HOSPITALAR DESCARTÁVEL,Material: tecido não tecido, Tipo Uso: descartável, Gramatura: 20 g/m², Características Adicionais:  com elástico em toda volta (tipo elastex);UN;20.000;CIA SUPRIMENTOS (703699);20.000; R$ 0,1200 ; R$2.400,00 ;19/11/2020;172;20/11/2020;20/11/2020;23/11/2020;.PASS 22/12;;6;;;;;;TOUCA HOSPITALAR
184/2020;NUAL;13/11/2020;00060-00494373/2020-78;Robson;746/2020;1;201158;7;X;X;SAPATILHA DESCARTÁVEL. Material: polipropileno antiderrapante, Características Adicionais: gramatura mínima de 40g/m², resistente, com acabamento elástico que permita bom ajuste e cobertura completa do calçado até o tornozelo. Tamanho com aproximadamente 35 cm de comprimento por 20 cm de altura. Embalagem com 50 pares (100 unidades). Unidade de estoque: par (PAR). Unidade de fornecimento: par.;PR;20.000;*CANCELADO;;; R$-   ;;;;;;;;6;ALTERADO A DESCRIÇÃO NO SIS DE 30G PARA 40G;;;;;SAPATILHA DESCARTÁVEL
509/2020;NFH;13/11/2020;00060-00493663/2020-02;Robson;747/2020;1;36573;2;X;X;"Parafina histológica, aspecto físico sólido, branca, ponto fusão 59  63 °c, apresentação em lentilha. Aplicação: Processamento de materiais de biópsias e peças cirúrgicas,para confecção de lâminas histológicas. Composição: Cera de petróleo Características adicionais: Aspecto: - Estado físico: Sólido - Forma: Lentilhas - Cor: Branca Odor: Baixo odor, porém característico de hidrocarbonetos. Ponto de fusão/ponto de congelamento: 59 63 °C (ASTM D87)Ponto de fulgor: > 200 °C (ASTM D-92); Densidade relativa: 0,790 à 80°C (água como padrão) Solubilidades: - Na água: Insolúvel -Em Tolueno: aproximadamente 14g/100g de tolueno à 20 °C.Prazo de validade: No mínimo 75% da validade total registrada na embalagem do produto no momento da entrega.";KG;50;CIA SUPRIMENTOS (703699);50; R$ 35,0000 ; R$1.750,00 ;01/12/2020;180;15/12/2020;16/12/2020;17/12/2020;.PASS 22/12;;6;;;;;;Parafina histológica,
510/2020;NFH;13/11/2020;00060-00493751/2020-04;Robson;748/2020;1;90975;1;X;X;ETOMIDATO SOLUÇAO INJETAVEL 2 MG/ML AMPOLA 10 ML;AMP;50;CIENTÍFICA (700617);50; R$ 13,7800 ; R$689,00 ;01/12/2020;139578;01/12/2020;02/12/2020;08/12/2020;.PASS 22/12;;6;;;;;;ETOMIDATO SOLUÇAO INJETAVEL 2 MG/ML AMPOLA 10 ML
512/2020;NFH;13/11/2020;00060-00493908/2020-93;Robson;749/2020;1;90590;4;X;X;SACARATO DE HIDROXIDO DE FERRO III SOLUÇAO INJETAVEL ENDOVENOSA 20MG/ML AMPOLA 5ML;AMP;900;*CANCELADO;;; R$-   ;16/11/2020;;;;;;;6;SEDE ABASTECIDA;;;;;SACARATO DE HIDROXIDO DE FERRO III SOLUÇAO INJETAVEL ENDOVENOSA 20MG/ML AMPOLA 5ML
513/2020;NFH;13/11/2020;00060-00494588/2020-99;Robson;750/2020;1;34859;2;X;X;TUBO DE SILICONE Nº 204, Tamanho/Capacidade: diâmetro interno: 6 mm, diâmetro externo: 12 mm, comprimento em unidade metros.  Aplicação: tubo extensor para oxigenoterapia, Material: 100% silicone, Características Adicionais: tubo 100% silicone, liso,macio,flexível, dureza do silicone de 40 SHORE A, com espessura regular na parede interna e externa, textura homogênea, ausência de resíduo interno, resistente a autoclavação (temperatura 134ºC) sem colabar em suas paredes, com registro no Ministério da Saúde, Apresentação: embalado individualmente em saco plástico resistente.;MT;120;APOLLO (703256);120; R$ 7,1000 ; R$852,00 ;01/12/2020;16834;30/11/2020;30/11/2020;08/12/2020;.PASS 22/12;;6;;;;;;TUBO DE SILICONE Nº 204
187/2020;NUAL;17/11/2020;00060-00500942/2020-21;Clayton;751/2020;1;5221;4;X;X;SACO PLÁSTICO,Material: confeccionado com matéria-prima não reciclada, atóxico, onodoro, Cor: incolor, Largura: 40 cm, Altura: 60 cm, Espessura: 0,06 micras, Características Adicionais: bobinas picotadas de 40 cm de largura x 60 cm de comprimento, que permita boa selagem, Unidade De Fornecimento: bobina;KG;400;JD PAPELARIA (703434);300; R$ 15,8000 ; R$4.740,00 ;19/11/2020;;;;;;;6;;;;;;SACO PLÁSTICO
188/2020;NUAL;17/11/2020;00060-00501025/2020-64;Clayton;752/2020;1;31635;5;X;X;ETIQUETA AUTOADESIVA, Cor: Vermelho, Tamanho: 2cm x 1cm com os dizeres: ATENÇÃO! MEDICAMENTO DE ALTA VIGILÂNCIA.;UN;25.000;RV GRÁFICA (703134);25.000; R$ 0,0165 ; R$412,50 ;19/11/2020;;;;;;;6;;;;;;ETIQUETA AUTOADESIVA
188/2020;NUAL;17/11/2020;00060-00501025/2020-64;Clayton;752/2020;2;31162;1;X;X;ETIQUETA AUTOADESIVA, Cor: Vermelho, Tamanho: 4cm x 5cm com os dizeres: ATENÇÃO! MEDICAMENTO DE ALTA VIGILÂNCIA.;UN;5.000;RV GRÁFICA (703134);5.000; R$ 0,0500 ; R$250,00 ;19/11/2020;;;;;;;6;;;;;;ETIQUETA AUTOADESIVA
189/2020;NUAL;17/11/2020;00060-00501186/2020-58;Clayton;753/2020;1;65666;3;X;X;ETIQUETA AUTO-ADESIVA TÉRMICA para FARMÁCIA, para fracionamento de medicamentos, Material: celulose vegetal em adesivo sintético, Tamanho Etiqueta: 38x10 mm, Aplicação: formulário contínuo, Número Colunas: 2, Cor: branca, Embalagem: em caixa. Deverá ser compatível com a impressora ZEBRA, modelo GC420d;MH;300;RV GRÁFICA (703134);300; R$ 15,0000 ; R$4.500,00 ;19/11/2020;;;;;;;6;;;;;;ETIQUETA AUTO-ADESIVA para FARMÁCIA
520/2020;NFH;18/11/2020;00060-00502225/2020-34;Robson;754/2020;1;16050;2;X;X;PLACA PRONTA PARA USO BIPARTIDA ÁGAR CLED / MAC CONKEY 90 X 15MM, Aplicação: identificação e isolamento microbiológico.;UN;1.000;ATD (700657);1.000; R$ 2,9950 ; R$2.995,00 ;01/12/2020;4036;11/12/220;12/12/2020;17/12/2020;.PASS 22/12;;6;;;;;;PLACA PRONTA PARA USO BIPARTIDA ÁGAR CLED / MAC CONKEY 90 X 15MM
520/2020;NFH;18/11/2020;00060-00502225/2020-34;Robson;754/2020;2;95277;2;X;X;PLACA PRONTA PARA USO AGAR MAC CONKEY 90 X 15MM;UN;200;ATD (700657);200; R$ 2,4600 ; R$492,00 ;01/12/2020;4036;11/12/220;12/12/2020;17/12/2020;.PASS 22/12;;6;;;;;;PLACA PRONTA PARA USO AGAR MAC CONKEY 90 X 15MM
520/2020;NFH;18/11/2020;00060-00502225/2020-34;Robson;754/2020;3;23063;2;X;X;AGAR SCREENING CROMOGENICO PARA IDENTIFICAÇAO DE BACTERIAS PRODUTORAS DE CARBAPENEMASE.  Aplicação: teste screening de identificação microbiológica em meio de cultura. Forma de apresentação: placas pronto uso.;UN;120;ATD (700657);120; R$ 7,5500 ; R$906,00 ;01/12/2020;4036;11/12/220;12/12/2020;17/12/2020;.PASS 22/12;;6;;;;;;AGAR SCREENING CROMOGENICO PARA IDENTIFICAÇAO DE BACTERIAS PRODUTORAS DE CARBAPENEMASE
519/2020;NFH;18/11/2020;00060-00502043/2020-63;Robson;755/2020;1;36091;2;X;X;POLIDOCANOL 1% AMPOLA 2 ML;AMP;20;FLUKKA (702981);20; R$ 7,0000 ; R$140,00 ;01/12/2020;;;;;;;6;;;;;;POLIDOCANOL 1
519/2020;NFH;18/11/2020;00060-00502043/2020-63;Robson;755/2020;2;28477;2;X;X;POLIDOCANOL 3% AMPOLA 2ML;MT;20;FLUKKA (702981);20; R$ 7,0000 ; R$140,00 ;01/12/2020;;;;;;;6;;;;;;POLIDOCANOL 3% AMPOLA 2ML
518/2020;NFH;18/11/2020;00060-00501750/2020-32;Robson;756/2020;1;95131;5;X;X;CAL SODADA, Absorvedor de CO2. Utilizado em circuito respiratório de aparelhos de anestesia. Uso exclusivo em anestesia. Composição: 97% de hidróxido de cálcio, 3% de hidróxido de sódio, 0,03% de indicador de cor e 13 a 17 % de água. Apresentado na forma de filamento poroso de 3 mm de diâmetro. Embalagem de 5 litros (4,5 KG);KG;30;MAFRA (703141);27; R$ 25,9800 ; R$701,46 ;01/12/2020;407383;01/12/2020;02/12/2020;08/12/2020;.PASS 22/12;;6;;;;;;CAL SODADA
519/2020;NFH;18/11/2020;00060-00501676/2020-54;Robson;757/2020;1;19648;2;X;X;ALCOOL ETILICO HIDRATADO 70% (70°GL) FRASCO 1000ML;FR;1.000;PREMIUM (703530);996; R$ 2,9900 ; R$2.978,04 ;01/12/2020;10240;03/12/2020;04/12/2020;08/12/2020;.PASS 22/12;;6;;;;;;ALCOOL ETILICO HIDRATADO 70% (70°GL) FRASCO 1000ML
516/2020;NFH;18/11/2020;00060-00501553/2020-13;Robson;758/2020;1;90552;6;X;X;CLORETO DE POTASSIO SOLUCAO INJETAVEL 10 % (1,34 MEQ/ML) AMPOLA 10 ML;AMP;800;*CANCELADO;; R$ 0,3023 ; R$-   ;01/12/2020;;;;;;;6;EMPRESA DESISTIU;;;;; CLORETO DE POTASSIO SOLUCAO INJETAVEL 10 % (1
515/2020;NFH;18/11/2020;00060-00500874/2020-09;Robson;759/2020;1;90925;8;X;X;CEFAZOLINA SODICA PO PARA SOLUCAO INJETAVEL 1 G FRASCO AMPOLA;AMP;1.000;*CANCELADO;; R$ 8,5000 ; R$-   ;;;;;;;;6;SEM SALDO NO SIS;;;;;CEFAZOLINA SODICA PO PARA SOLUCAO INJETAVEL 1 G FRASCO AMPOLA
514/2020;NFH;18/11/2020;00060-00500699/2020-41;Robson;760/2020;1;90255;8;X;X;BROMOPRIDA SOLUCAO INJETAVEL 5MG/ML AMPOLA 2ML;AMP;1.000;SOQUIMICA (702925);1.000; R$ 0,9100 ; R$910,00 ;01/12/2020;112896;02/12/2020;04/12/2020;08/12/2020;.PASS 22/12;;6;;;;;;BROMOPRIDA
521/2020;NFH;19/11/2020;00060-00503619/2020-18;Clayton;761/2020;1;90610;11;X;X;HEPARINA SODICA SOLUÇAO INJETAVEL 5000 UI/ML FRASCO AMPOLA 5 ML;FA;300;CIENTÍFICA (700617);200; R$ 22,3000 ; R$4.460,00 ;25/11/2020;138927;25/11/2020;30/11/2020;08/12/2020;.PASS 22/12;;6;;;;;;HEPARINA SODICA SOLUÇAO INJETAVEL 5000 UI/ML FRASCO AMPOLA 5 ML
